Symbol,Name,Last Sale,Net Change,% Change,Market Cap,Country,IPO Year,Volume,Sector,Industry
LANC,Lancaster Colony Corporation Common Stock,$171.33,5.06,3.043%,4716372240.00,United States,,78578,Consumer Staples,Packaged Foods
LAND,Gladstone Land Corporation Common Stock,$15.55,0.34,2.235%,557287773.00,United States,2013,58795,Real Estate,Real Estate Investment Trusts
LANDM,Gladstone Land Corporation 5.00% Series D Cumulative Term Preferred Stock,$23.9202,0.1402,0.59%,857262700.00,United States,,1112,Real Estate,Real Estate Investment Trusts
LANDO,Gladstone Land Corporation 6.00% Series B Cumulative Redeemable Preferred Stock,$19.01,0.04,0.211%,681288782.00,United States,,5466,Real Estate,Real Estate Investment Trusts
LANDP,Gladstone Land Corporation 6.00% Series C Cumulative Redeemable Preferred Stock,$18.97,0.07,0.37%,0.00,United States,,13662,Real Estate,Real Estate Investment Trusts
LARK,Landmark Bancorp Inc. Common Stock,$18.855,0.105,0.56%,98437562.00,United States,,3160,Finance,Major Banks
LASE,Laser Photonics Corporation Common Stock,$2.04,0.04,2.00%,16836975.00,United States,2022,54865,Industrials,Industrial Machinery/Components
LASR,nLIGHT Inc. Common Stock,$10.5925,0.2825,2.74%,492662132.00,United States,2018,78179,Technology,Semiconductors
LATG,LatAmGrowth SPAC Class A Ordinary Shares,$10.77,-0.01,-0.093%,175012500.00,Mexico,2022,21449,Finance,Blank Checks
LAUR,Laureate Education Inc. Common Stock,$14.12,0.06,0.427%,2219952048.00,United States,2017,243092,Consumer Discretionary,Educational Services
LAZR,Luminar Technologies Inc.  Class A Common Stock,$5.115,-0.065,-1.255%,1996792830.00,United States,2019,3692632,Consumer Discretionary,Auto Parts:O.E.M.
LAZY,Lazydays Holdings Inc. Common Stock,$10.05,-0.22,-2.142%,139858423.00,United States,,79186,Consumer Discretionary,Retail-Auto Dealers and Gas Stations
LBAI,Lakeland Bancorp Inc. Common Stock,$13.21,0.37,2.882%,859039457.00,United States,,143806,Finance,Major Banks
LBBB,Lakeshore Acquisition II Corp. Ordinary Shares,$10.83,0.01,0.092%,0.00,United States,2022,109,Finance,Blank Checks
LBBBR,Lakeshore Acquisition II Corp. Rights,$0.17,0.015,9.677%,0.00,United States,2022,5023,Finance,Blank Checks
LBBBU,Lakeshore Acquisition II Corp. Unit,$10.93,0.00,0.00%,0.00,United States,2022,2,Finance,Blank Checks
LBBBW,Lakeshore Acquisition II Corp. Warrants,$0.02,0.001,5.263%,0.00,United States,2022,27929,Finance,Blank Checks
LBC,Luther Burbank Corporation Common Stock,$8.84,0.22,2.552%,451086442.00,United States,2017,6178,Finance,Major Banks
LBPH,Longboard Pharmaceuticals Inc. Common Stock,$6.185,0.275,4.653%,142125369.00,United States,2021,12424,Health Care,Biotechnology: Pharmaceutical Preparations
LBRDA,Liberty Broadband Corporation Class A Common Stock,$93.28,1.36,1.48%,13638758155.00,United States,,67975,Telecommunications,Cable & Other Pay Television Services
LBRDK,Liberty Broadband Corporation Class C Common Stock,$93.74,1.45,1.571%,13706016181.00,United States,,245234,Telecommunications,Cable & Other Pay Television Services
LBRDP,Liberty Broadband Corporation Series A Cumulative Redeemable Preferred Stock,$22.6712,0.2812,1.256%,3314826478.00,United States,,2448,Telecommunications,Cable & Other Pay Television Services
LBTYA,Liberty Global plc Class A Ordinary Shares,$18.485,0.215,1.177%,7843754912.00,United Kingdom,,812245,Telecommunications,Cable & Other Pay Television Services
LBTYB,Liberty Global plc Class B Ordinary Shares,$18.25,0.00,0.00%,7744037173.00,United Kingdom,,1,Telecommunications,Cable & Other Pay Television Services
LBTYK,Liberty Global plc Class C Ordinary Shares,$19.775,0.275,1.41%,8391141649.00,United Kingdom,,1158205,Telecommunications,Cable & Other Pay Television Services
LCA,Landcadia Holdings IV Inc. Class A Common Stock,$10.36,0.00,0.00%,143564083.00,United States,2021,2,Finance,Blank Checks
LCAA,L Catterton Asia Acquisition Corp Class A Ordinary Shares,$10.635,0.005,0.047%,0.00,Singapore,2021,867,Finance,Blank Checks
LCAAW,L Catterton Asia Acquisition Corp Warrant,$0.55,0.01,1.852%,0.00,Singapore,2021,260,Finance,Blank Checks
LCAHU,Landcadia Holdings IV Inc. Units,$10.36,0.00,0.00%,0.00,United States,2021,600,Finance,Blank Checks
LCAHW,Landcadia Holdings IV Inc. Warrant ,$0.0823,-0.0092,-10.055%,0.00,United States,2021,145,Finance,Blank Checks
LCFY,Locafy Limited Ordinary Share,$7.37,-0.03,-0.405%,7591100.00,Australia,2022,2461,,
LCFYW,Locafy Limited Warrant,$7.62,0.00,0.00%,156429479.00,Australia,2022,1,,
LCID,Lucid Group Inc. Common Stock,$6.0443,0.1743,2.969%,13797022973.00,United States,,14911577,Consumer Discretionary,Auto Manufacturing
LCNB,LCNB Corporation Common Stock,$15.15,0.08,0.531%,168418990.00,United States,,6556,Finance,Major Banks
LCUT,Lifetime Brands Inc. Common Stock,$5.515,0.085,1.565%,120305512.00,United States,1991,17009,Consumer Discretionary,Industrial Machinery/Components
LDWY,Lendway Inc. Common Stock (DE),$5.75,0.18,3.232%,10336539.00,United States,,28898,Consumer Discretionary,Advertising
LE,Lands' End Inc. Common Stock,$6.90,-0.02,-0.289%,220290959.00,United States,,80218,Consumer Discretionary,Clothing/Shoe/Accessory Stores
LECO,Lincoln Electric Holdings Inc. Common Shares,$180.72,1.78,0.995%,10375600193.00,United States,,183148,Industrials,Industrial Machinery/Components
LEDS,SemiLEDS Corporation Common Stock,$2.00,0.29,16.959%,9830564.00,Taiwan,2010,92334,Technology,Semiconductors
LEE,Lee Enterprises Incorporated Common Stock,$11.3022,-0.4278,-3.647%,68631389.00,United States,,10565,Consumer Discretionary,Newspapers/Magazines
LEGH,Legacy Housing Corporation Common Stock (TX),$21.63,0.57,2.707%,527590221.00,United States,2018,19688,Consumer Discretionary,Homebuilding
LEGN,Legend Biotech Corporation American Depositary Shares,$65.58,0.20,0.306%,10825109599.00,United States,2020,230343,Health Care,Biotechnology: Pharmaceutical Preparations
LESL,Leslie's Inc. Common Stock,$5.525,0.035,0.638%,1016627271.00,United States,2020,2491917,Miscellaneous,Diversified Commercial Services
LEXX,Lexaria Bioscience Corp. Common Stock,$0.9501,-0.0099,-1.031%,7687877.00,Canada,,13848,Health Care,Biotechnology: Pharmaceutical Preparations
LEXXW,Lexaria Bioscience Corp. Warrant,$0.20,0.00,0.00%,1618330.00,Canada,,9102,Health Care,Biotechnology: Pharmaceutical Preparations
LFAC,LF Capital Acquisition Corp. II Class A Common Stock,$10.87,0.02,0.184%,0.00,United States,2022,11200,Finance,Blank Checks
LFACW,LF Capital Acquisition Corp. II Warrants,$0.05,0.0004,0.806%,0.00,United States,2022,15308,Finance,Blank Checks
LFCR,Lifecore Biomedical Inc. Common Stock,$7.90,0.09,1.152%,239545135.00,United States,,141843,Health Care,Biotechnology: Pharmaceutical Preparations
LFLY,Leafly Holdings Inc. Common Stock,$9.18,-0.07,-0.757%,19008833.00,United States,2019,19155,Technology,Computer Software: Prepackaged Software
LFLYW,Leafly Holdings Inc. Warrant,$0.038,0.0015,4.11%,78686.00,United States,2019,3117,Technology,Computer Software: Prepackaged Software
LFMD,LifeMD Inc. Common Stock,$4.885,0.185,3.936%,176019935.00,United States,,279681,Health Care,Medical/Nursing Services
LFMDP,LifeMD Inc. 8.875% Series A Cumulative Perpetual Preferred Stock,$18.9399,0.2399,1.283%,682456492.00,United States,,2637,Health Care,Medical/Nursing Services
LFST,LifeStance Health Group Inc. Common Stock,$6.935,0.025,0.362%,2621466346.00,United States,2021,261910,Health Care,Medical/Nursing Services
LFUS,Littelfuse Inc. Common Stock,$252.95,4.86,1.959%,6296307202.00,United States,,29528,Energy,Electrical Products
LFVN,Lifevantage Corporation Common Stock (Delaware),$6.49,-0.67,-9.358%,82434267.00,United States,,59659,Health Care,Biotechnology: Pharmaceutical Preparations
LGHL,Lion Group Holding Ltd. American Depositary Share,$1.90,-0.07,-3.553%,2226979.00,China,,86551,Finance,Investment Bankers/Brokers/Service
LGHLW,Lion Group Holding Ltd. Warrant,$0.0095,-0.0006,-5.941%,11135.00,China,,111473,Finance,Investment Bankers/Brokers/Service
LGIH,LGI Homes Inc. Common Stock,$117.3978,1.3978,1.205%,2764253412.00,United States,2013,68056,Consumer Discretionary,Homebuilding
LGMK,LogicMark Inc. Common Stock (NV),$2.10,0.01,0.478%,2782536.00,United States,,4248,Health Care,Industrial Specialties
LGND,Ligand Pharmaceuticals Incorporated Common Stock,$62.58,-0.15,-0.239%,1086091983.00,United States,,69326,Health Care,Biotechnology: Pharmaceutical Preparations
LGO,Largo Inc. Common Shares,$3.23,0.04,1.254%,206820130.00,Canada,,13400,,
LGST,Semper Paratus Acquisition Corporation Class A Ordinary Shares,$10.77,0.00,0.00%,0.00,United States,2022,1,Finance,Blank Checks
LGSTU,Semper Paratus Acquisition Corporation Unit,$10.85,0.00,0.00%,0.00,United States,2021,400,Finance,Blank Checks
LGSTW,Semper Paratus Acquisition Corporation Warrant,$0.0688,0.0068,10.968%,0.00,United States,2022,1600,Finance,Blank Checks
LGVC,LAMF Global Ventures Corp. I Class A Ordinary Shares,$10.61,0.00,0.00%,369645323.00,United States,2021,19184,,
LGVCW,LAMF Global Ventures Corp. I Warrant,$0.10,0.0125,14.286%,0.00,United States,2021,43149,,
LGVN,Longeveron Inc. Class A Common Stock,$2.34,0.02,0.862%,49531398.00,United States,2021,26204,Health Care, Medicinal Chemicals and Botanical Products 
LGVNR,Longeveron Inc. Subscription Right,$0.0086,-0.0001,-1.149%,182038.00,United States,,413669,,
LI,Li Auto Inc. American Depositary Shares,$40.785,0.305,0.753%,42067918522.00,China,2020,1432224,Consumer Discretionary,Auto Manufacturing
LIAN,LianBio American Depositary Shares,$1.6599,-0.0101,-0.605%,177887514.00,United States,2021,13025,Health Care,Biotechnology: Pharmaceutical Preparations
LIBY,Liberty Resources Acquisition Corp. Class A Common Stock,$10.90,0.00,0.00%,0.00,United States,2021,105,Finance,Blank Checks
LIBYU,Liberty Resources Acquisition Corp. Unit,$10.91,0.00,0.00%,0.00,United States,2021,5,Finance,Blank Checks
LIBYW,Liberty Resources Acquisition Corp. Warrant,$0.0611,-0.0089,-12.714%,0.00,United States,2021,100,Finance,Blank Checks
LICN,Lichen China Limited Class A Ordinary Shares,$0.92,-0.0171,-1.825%,16560000.00,China,2023,47850,,
LIDR,AEye Inc. Class A Common Stock,$0.243,0.0066,2.792%,44908532.00,United States,2021,327656,Consumer Discretionary,Auto Parts:O.E.M.
LIDRW,AEye Inc. Warrant,$0.0225,0.0025,12.50%,4158197.00,United States,2021,5000,Consumer Discretionary,Auto Parts:O.E.M.
LIFE,aTyr Pharma Inc. Common Stock,$1.69,0.05,3.049%,96408031.00,United States,2015,170634,Health Care,Biotechnology: Biological Products (No Diagnostic Substances)
LIFW,MSP Recovery Inc. Class A Common Stock,$0.0562,-0.0001,-0.178%,193275288.00,United States,2020,1130951,Technology,Computer Software: Prepackaged Software
LIFWW,MSP Recovery Inc. Warrant,$0.0018,0.00,0.00%,6190312.00,United States,,47900,Technology,Computer Software: Prepackaged Software
LIFWZ,MSP Recovery Inc. Warrant,$0.065,-0.0278,-29.957%,223539034.00,United States,2020,1400,Technology,Computer Software: Prepackaged Software
LILA,Liberty Latin America Ltd. Class A Common Stock,$9.02,0.15,1.691%,1874475704.00,United States,,168069,Telecommunications,Cable & Other Pay Television Services
LILAK,Liberty Latin America Ltd. Class C Common Stock,$9.00,0.15,1.695%,1870319439.00,United States,,1003547,Telecommunications,Cable & Other Pay Television Services
LILM,Lilium NV Class A Ordinary Shares,$1.03,-0.01,-0.962%,385910100.00,Germany,,1480682,Industrials,Aerospace
LILMW,Lilium N.V. Warrants,$0.1666,-0.0034,-2.00%,65521095.00,Germany,,26591,Industrials,Aerospace
LINC,Lincoln Educational Services Corporation Common Stock,$8.555,-0.015,-0.175%,268277186.00,United States,2005,12692,Consumer Discretionary,Other Consumer Services
LIND,Lindblad Expeditions Holdings Inc. Common Stock,$8.35,0.18,2.203%,445297751.00,United States,2013,103779,Consumer Discretionary,Transportation Services
LINK,Interlink Electronics Inc. Common Stock,$9.21,-0.10,-1.074%,60710358.00,United States,,4382,Technology,Industrial Machinery/Components
LIPO,Lipella Pharmaceuticals Inc. Common Stock,$2.11,0.00,0.00%,12119724.00,United States,2022,93,Health Care,Biotechnology: Pharmaceutical Preparations
LIQT,LiqTech International Inc. Common Stock,$4.03,0.11,2.806%,22971911.00,Denmark,,5842,Technology,Industrial Machinery/Components
LITE,Lumentum Holdings Inc. Common Stock,$48.26,1.25,2.659%,3218942000.00,United States,,515736,Telecommunications,Telecommunications Equipment
LITM,Snow Lake Resources Ltd. Common Shares,$1.835,-0.035,-1.872%,32883200.00,Canada,2021,23038,Basic Materials,Other Metals and Minerals
LIVB,LIV Capital Acquisition Corp. II Class A Ordinary Shares,$10.85,0.01,0.092%,0.00,Mexico,2022,2567,Finance,Blank Checks
LIVBU,LIV Capital Acquisition Corp. II Unit,$10.57,0.00,0.00%,0.00,Mexico,2022,1,Finance,Blank Checks
LIVBW,LIV Capital Acquisition Corp. II Warrants,$0.0201,-0.0025,-11.062%,0.00,Mexico,2022,154027,Finance,Blank Checks
LIVE,Live Ventures Incorporated Common Stock,$26.45,-0.80,-2.936%,83696529.00,United States,,12995,Consumer Discretionary,Other Specialty Stores
LIVN,LivaNova PLC Ordinary Shares,$56.72,-0.26,-0.456%,3056242399.00,United Kingdom,,177152,Health Care,Biotechnology: Electromedical & Electrotherapeutic Apparatus
LIXT,Lixte Biotechnology Holdings Inc. Common Stock,$2.23,0.03,1.364%,5015917.00,United States,,24175,Health Care,Biotechnology: Pharmaceutical Preparations
LIZI,LIZHI INC. American Depositary Shares,$0.4601,-0.0027,-0.583%,23844657.00,China,2020,176658,Technology,Computer Software: Programming Data Processing
LKCO,Luokung Technology Corp Ordinary Shares,$1.0801,0.0201,1.896%,17731591.00,China,,79214,Technology,EDP Services
LKFN,Lakeland Financial Corporation Common Stock,$49.68,0.44,0.894%,1263522121.00,United States,,35897,Finance,Major Banks
LKQ,LKQ Corporation Common Stock,$50.065,0.405,0.816%,13395210015.00,United States,2003,534208,Consumer Discretionary,Motor Vehicles
LLYVA,Liberty Media Corporation Series A Liberty Live Common Stock,$32.44,0.93,2.951%,18203140084.00,United States,,71901,Industrials,Broadcasting
LLYVK,Liberty Media Corporation Series C Liberty Live Common Stock,$32.73,0.97,3.054%,18365868525.00,United States,,146525,Industrials,Broadcasting
LMAT,LeMaitre Vascular Inc. Common Stock,$56.695,0.705,1.259%,1262208892.00,United States,2006,37674,Health Care,Medical/Dental Instruments
LMB,Limbach Holdings Inc. Common Stock,$33.15,0.27,0.821%,364763506.00,United States,,121857,Consumer Discretionary,Engineering & Construction
LMDX,LumiraDx Limited Common Shares,$0.32,-0.0249,-7.219%,52582976.00,Cayman Islands,,39253,Health Care,Biotechnology: In Vitro & In Vivo Diagnostic Substances
LMFA,LM Funding America Inc. Common Stock,$0.5784,0.0244,4.404%,8474649.00,United States,2015,7221,Finance,Finance: Consumer Services
LMNL,Liminal BioSciences Inc. Common Shares,$8.48,0.0394,0.467%,27556048.00,Canada,,2766,Health Care,Biotechnology: Pharmaceutical Preparations
LMNR,Limoneira Co Common Stock,$15.18,0.12,0.797%,272919854.00,United States,,23916,Consumer Staples,Farming/Seeds/Milling
LNKB,LINKBANCORP Inc. Common Stock,$6.97,0.09,1.308%,113164021.00,United States,,686,,
LNSR,LENSAR Inc. Common Stock,$3.20,0.16,5.263%,35987856.00,United States,,1648,Health Care,Medical Electronics
LNT,Alliant Energy Corporation Common Stock,$51.91,0.37,0.718%,13118648066.00,United States,,708598,Utilities,Power Generation
LNTH,Lantheus Holdings Inc. Common Stock,$67.00,4.60,7.372%,4584856699.00,United States,2015,1179351,Health Care,Biotechnology: In Vitro & In Vivo Diagnostic Substances
LNW,Light & Wonder Inc. Common Stock,$78.51,1.63,2.12%,7172427628.00,United States,,376661,Technology,EDP Services
LNZA,LanzaTech Global Inc. Common Stock,$8.035,0.095,1.196%,1572244624.00,United States,2021,292989,Industrials,Major Chemicals
LNZAW,LanzaTech Global Inc. Warrant,$1.44,0.04,2.857%,281771283.00,United States,2021,64430,Industrials,Major Chemicals
LOAN,Manhattan Bridge Capital Inc,$4.7428,0.0528,1.126%,54360005.00,United States,,36230,Real Estate,Real Estate Investment Trusts
LOCO,El Pollo Loco Holdings Inc. Common Stock,$9.16,0.09,0.992%,324853840.00,United States,2014,164942,Consumer Discretionary,Restaurants
LOGI,Logitech International S.A. Ordinary Shares,$70.27,-0.31,-0.439%,11154498882.00,United States,1997,200016,Technology,Computer peripheral equipment
LOOP,Loop Industries Inc. Common Stock,$3.35,0.02,0.601%,159195976.00,Canada,,19442,Industrials,Major Chemicals
LOPE,Grand Canyon Education Inc. Common Stock,$113.41,-0.18,-0.158%,3433474821.00,United States,2008,80056,Consumer Discretionary,Educational Services
LOVE,The Lovesac Company Common Stock,$22.21,0.43,1.974%,337969303.00,United States,2018,430488,Consumer Discretionary,Other Specialty Stores
LPCN,Lipocine Inc. Common Stock,$3.82,0.01,0.262%,20306471.00,United States,,4220,Health Care,Biotechnology: Pharmaceutical Preparations
LPLA,LPL Financial Holdings Inc. Common Stock,$245.03,2.20,0.906%,18695149717.00,United States,2010,263885,Finance,Investment Bankers/Brokers/Service
LPRO,Open Lending Corporation Common Stock,$7.96,-0.03,-0.375%,960755706.00,United States,,216680,Finance,Finance: Consumer Services
LPSN,LivePerson Inc. Common Stock,$4.42,0.20,4.739%,344571986.00,United States,2000,1117190,Technology,Computer Software: Prepackaged Software
LPTH,LightPath Technologies Inc. Class A Common Stock,$1.70,0.00,0.00%,63453945.00,United States,1996,83650,Technology,Semiconductors
LPTX,Leap Therapeutics Inc. Common Stock,$1.70,0.01,0.592%,43461204.00,United States,,108575,Health Care,Biotechnology: Biological Products (No Diagnostic Substances)
LQDA,Liquidia Corporation Common Stock,$6.81,-0.14,-2.014%,440886864.00,United States,2018,260771,Health Care,Biotechnology: Pharmaceutical Preparations
LQDT,Liquidity Services Inc. Common Stock,$18.45,0.62,3.477%,566251681.00,United States,2006,49481,Consumer Discretionary,Business Services
LQR,LQR House Inc. Common Stock,$0.7035,0.0028,0.40%,7847848.00,United States,2023,1896267,,
LRCX,Lam Research Corporation Common Stock,$656.36,-2.30,-0.349%,88175713515.00,United States,1984,603976,Technology,Industrial Machinery/Components
LRFC,Logan Ridge Finance Corporation Common Stock,$21.11,-0.17,-0.799%,56813195.00,United States,2013,3767,Finance,Finance Companies
LRMR,Larimar Therapeutics Inc. Common Stock,$4.035,0.03,0.749%,174624713.00,United States,2014,98084,Health Care,Biotechnology: Pharmaceutical Preparations
LSAK,Lesaka Technologies Inc. Common Stock,$3.93,-0.02,-0.506%,241761260.00,South Africa,,7251,Finance,Investment Bankers/Brokers/Service
LSBK,Lake Shore Bancorp Inc. Common Stock,$10.63,-0.04,-0.375%,72672144.00,United States,2006,169,Finance,Savings Institutions
LSCC,Lattice Semiconductor Corporation Common Stock,$91.49,1.62,1.803%,12610698255.00,United States,,666727,Technology,Semiconductors
LSDI,Lucy Scientific Discovery Inc. Common Stock,$0.65,-0.003,-0.459%,10621917.00,Canada,2023,117891,Health Care,Pharmaceuticals and Biotechnology
LSEA,Landsea Homes Corporation Common Stock,$9.71,0.25,2.643%,374721659.00,United States,2018,28995,Consumer Discretionary,Homebuilding
LSEAW,Landsea Homes Corporation Warrant,$0.2005,0.0085,4.427%,7737558.00,United States,2018,16936,Consumer Discretionary,Homebuilding
LSTA,Lisata Therapeutics Inc. Common Stock,$2.02,0.03,1.508%,16447561.00,United States,,34727,Health Care,Misc Health and Biotechnology Services
LSTR,Landstar System Inc. Common Stock,$188.9125,3.1625,1.703%,6790737892.00,United States,1993,87593,Industrials,Trucking Freight/Courier Services
LSXMA,Liberty Media Corporation Series A Liberty SiriusXM Common Stock,$22.98,0.53,2.361%,12894826114.00,United States,,369695,Consumer Discretionary,Movies/Entertainment
LSXMB,Liberty Media Corporation Series B Liberty SiriusXM Common Stock,$23.195,0.00,0.00%,13015469613.00,United States,,2,Consumer Discretionary,Movies/Entertainment
LSXMK,Liberty Media Corporation Series C Liberty SiriusXM Common Stock,$23.36,0.49,2.143%,13108056485.00,United States,,433636,Industrials,Broadcasting
LTBR,Lightbridge Corporation Common Stock,$4.60,0.11,2.45%,57819130.00,United States,,44829,Consumer Discretionary,Professional Services
LTRN,Lantern Pharma Inc. Common Stock,$4.19,-0.07,-1.643%,45541278.00,United States,2020,6945,Health Care,Biotechnology: Pharmaceutical Preparations
LTRPA,Liberty TripAdvisor Holdings Inc. Series A Common Stock,$0.5315,0.0115,2.212%,40691318.00,United States,,125952,Technology,EDP Services
LTRPB,Liberty TripAdvisor Holdings Inc. Series B Common Stock,$28.79,0.00,0.00%,2204144953.00,United States,,20,Technology,EDP Services
LTRX,Lantronix Inc. Common Stock,$5.19,-0.10,-1.89%,191572818.00,United States,2000,182750,Telecommunications,Computer Communications Equipment
LTRY,Lottery.com Inc. Common Stock,$3.5983,-0.1617,-4.301%,,United States,2023,4310,Technology,Computer Software: Prepackaged Software
LTRYW,Lottery.com Inc. Warrants,$0.0126,-0.0022,-14.865%,,United States,2023,9557,Technology,Computer Software: Prepackaged Software
LUCD,Lucid Diagnostics Inc. Common Stock,$1.579,0.029,1.871%,69042885.00,United States,2021,13537,Health Care,Biotechnology: Electromedical & Electrotherapeutic Apparatus
LUCY,Innovative Eyewear Inc. Common Stock,$0.71,-0.0055,-0.769%,9171240.00,United States,2022,40805,Health Care,Ophthalmic Goods
LUCYW,Innovative Eyewear Inc. Series A Warrants,$0.1222,0.0011,0.908%,1578487.00,United States,2022,100,Health Care,Ophthalmic Goods
LULU,lululemon athletica inc. Common Stock,$390.075,1.105,0.284%,47364967266.00,Canada,2007,598242,Consumer Discretionary,Apparel
LUMO,Lumos Pharma Inc. Common Stock,$3.275,0.015,0.46%,25988556.00,United States,2011,5057,Health Care,Biotechnology: Pharmaceutical Preparations
LUNA,Luna Innovations Incorporated Common Stock,$6.26,0.18,2.961%,212368791.00,United States,2006,44038,Health Care,Biotechnology: Commercial Physical & Biological Resarch
LUNG,Pulmonx Corporation Common Stock,$10.36,0.13,1.271%,393967200.00,United States,2020,131627,Health Care,Industrial Specialties
LUNR,Intuitive Machines Inc. Class A Common Stock,$4.29,0.06,1.418%,371979130.00,United States,2021,93142,Industrials,Industrial Machinery/Components
LUNRW,Intuitive Machines Inc. Warrants,$0.3306,0.0054,1.661%,28665804.00,United States,2021,615,Industrials,Industrial Machinery/Components
LUXH,LuxUrban Hotels Inc. Common Stock,$3.5799,0.0599,1.702%,127790226.00,United States,2022,8644,Finance,Real Estate
LVLU,Lulu's Fashion Lounge Holdings Inc. Common Stock,$2.07,0.02,0.976%,83129480.00,United States,2021,22941,Consumer Discretionary,Catalog/Specialty Distribution
LVO,LiveOne Inc. Common Stock,$1.24,0.16,14.815%,111846010.00,United States,,383000,Consumer Discretionary,Restaurants
LVOX,LiveVox Holdings Inc. Class A Common Stock,$3.21,0.03,0.943%,302391701.00,United States,2021,15791,Technology,EDP Services
LVOXW,LiveVox Holdings Inc. Warrant,$0.34,-0.025,-6.849%,32029027.00,United States,2021,372,Technology,EDP Services
LVRO,Lavoro Limited Class A Ordinary Shares,$6.90,0.11,1.62%,804597270.00,Brazil,,11642,Finance,Blank Checks
LVROW,Lavoro Limited Warrant,$0.7299,0.0099,1.375%,0.00,Brazil,,12179,Finance,Blank Checks
LVTX,LAVA Therapeutics N.V. Ordinary Shares,$1.69,0.04,2.424%,44430100.00,Netherlands,2021,7031,Health Care,Biotechnology: Pharmaceutical Preparations
LWAY,Lifeway Foods Inc. Common Stock,$12.58,0.58,4.833%,184582780.00,United States,,155352,Consumer Staples,Packaged Foods
LWLG,Lightwave Logic Inc. Common Stock,$5.54,0.02,0.362%,645197480.00,United States,,209945,Industrials,Plastic Products
LX,LexinFintech Holdings Ltd. American Depositary Shares,$2.34,0.086,3.815%,380780920.00,China,2017,237057,Finance,Finance: Consumer Services
LXEH,Lixiang Education Holding Co. Ltd. American Depositary Shares,$0.2781,-0.0041,-1.453%,3707073.00,China,2020,163524,Consumer Discretionary,Educational Services
LXRX,Lexicon Pharmaceuticals Inc. Common Stock,$1.34,-0.07,-4.965%,328199091.00,United States,,2768098,Health Care,Biotechnology: Biological Products (No Diagnostic Substances)
LYEL,Lyell Immunopharma Inc. Common Stock,$1.74,0.025,1.458%,436786975.00,United States,2021,174718,Health Care,Biotechnology: Pharmaceutical Preparations
LYFT,Lyft Inc. Class A Common Stock,$11.54,0.27,2.396%,4357911777.00,United States,2019,5133777,Consumer Discretionary,Business Services
LYRA,Lyra Therapeutics Inc. Common Stock,$4.9143,0.2243,4.783%,243481741.00,United States,2020,278613,Health Care,Medical/Dental Instruments
LYT,Lytus Technologies Holdings PTV. Ltd. Common Shares,$0.3002,-0.0098,-3.161%,10253049.00,United Arab Emirates,2022,3901222,Technology,EDP Services
LYTS,LSI Industries Inc. Common Stock,$14.88,0.17,1.156%,424829595.00,United States,1985,52818,Consumer Discretionary,Building Products
LZ,LegalZoom.com Inc. Common Stock,$10.09,-0.005,-0.05%,1935158557.00,United States,2021,1075674,Technology,EDP Services
MACA,Moringa Acquisition Corp Class A Ordinary Shares,$10.86,0.00,0.00%,0.00,United States,2021,1,Finance,Blank Checks
MACAW,Moringa Acquisition Corp Warrant,$0.0325,0.00,0.00%,0.00,United States,2021,143,Finance,Blank Checks
MACK,Merrimack Pharmaceuticals Inc. Common Stock,$12.19,-0.08,-0.652%,174572417.00,United States,2012,25293,Health Care,Biotechnology: Pharmaceutical Preparations
MAMA,Mama's Creations Inc. Common Stock,$4.46,0.15,3.48%,166997506.00,United States,,297178,Consumer Staples,Specialty Foods
MANH,Manhattan Associates Inc. Common Stock,$201.63,1.99,0.997%,12434280547.00,United States,1998,191887,Technology,Computer Software: Prepackaged Software
MAPS,WM Technology Inc. Class A Common Stock ,$1.63,0.11,7.237%,242710268.00,United States,2019,404145,Consumer Discretionary,Other Consumer Services
MAPSW,WM Technology Inc. Warrants ,$0.19,0.02,11.765%,28291381.00,United States,2019,4750,Technology,Computer Software: Prepackaged Software
