Symbol,Name,Last Sale,Net Change,% Change,Market Cap,Country,IPO Year,Volume,Sector,Industry
DAWN,Day One Biopharmaceuticals Inc. Common Stock,$14.785,-0.075,-0.505%,1285907914.00,United States,2021,703737,Health Care,Biotechnology: Pharmaceutical Preparations
DBGI,Digital Brands Group Inc. Common Stock,$11.02,-0.16,-1.431%,3494464.00,United States,2021,109066,Consumer Discretionary,Clothing/Shoe/Accessory Stores
DBGIW,Digital Brands Group Inc. Warrant,$12.60,0.00,0.00%,3995485.00,United States,2021,151,Consumer Discretionary,Clothing/Shoe/Accessory Stores
DBTX,Decibel Therapeutics Inc. Common Stock,$5.17,0.01,0.194%,129906254.00,United States,2021,44864,Health Care,Biotechnology: Pharmaceutical Preparations
DBVT,DBV Technologies S.A. American Depositary Shares,$1.49,-0.03,-1.974%,286827843.00,France,2014,200054,Health Care,Biotechnology: Pharmaceutical Preparations
DBX,Dropbox Inc. Class A Common Stock,$27.665,0.055,0.199%,9621829982.00,United States,2018,1260977,Technology,Computer Software: Prepackaged Software
DCBO,Docebo Inc. Common Shares,$41.395,1.655,4.165%,1354477143.00,Canada,,31609,,
DCFC,Tritium DCFC Limited Ordinary Shares,$0.702,0.002,0.286%,109153980.00,Australia,,746570,Technology,Electronic Components
DCFCW,Tritium DCFC Limited Warrant,$0.2775,0.0003,0.108%,42483660.00,Australia,,4402,Technology,Electronic Components
DCGO,DocGo Inc. Common Stock,$6.405,0.355,5.868%,664748087.00,United States,2020,1201882,Health Care,Managed Health Care
DCOM,Dime Community Bancshares Inc. Common Stock,$20.98,0.46,2.242%,814588803.00,United States,,72641,Finance,Major Banks
DCOMP,Dime Community Bancshares Inc. Fixed-Rate Non-Cumulative Perpetual Preferred Stock Series A,$15.65,-0.21,-1.324%,607641314.00,United States,,10801,Finance,Major Banks
DCPH,Deciphera Pharmaceuticals Inc. Common Stock,$14.025,0.695,5.214%,1105466783.00,United States,2017,218550,Health Care,Biotechnology: Pharmaceutical Preparations
DCTH,Delcath Systems Inc. Common Stock,$4.69,0.16,3.532%,71646724.00,United States,,368166,Health Care,Medical/Dental Instruments
DDI,DoubleDown Interactive Co. Ltd. American Depository Shares,$9.30,-0.23,-2.413%,460846992.00,South Korea,2021,1824,Technology,EDP Services
DDOG,Datadog Inc. Class A Common Stock,$98.14,0.66,0.677%,31895446906.00,United States,2019,1193554,Technology,Computer Software: Prepackaged Software
DECA,Denali Capital Acquisition Corp. Class A Ordinary Shares,$10.89,0.01,0.092%,0.00,United States,2022,8926,Finance,Blank Checks
DECAW,Denali Capital Acquisition Corp. Warrant,$0.0648,0.00,0.00%,0.00,United States,2022,38,Finance,Blank Checks
DENN,Denny's Corporation Common Stock,$8.995,0.075,0.841%,498899436.00,United States,,268001,Consumer Discretionary,Restaurants
DERM,Journey Medical Corporation Common Stock,$2.57,-0.03,-1.154%,47481046.00,United States,2021,18434,Health Care,Biotechnology: Pharmaceutical Preparations
DFLI,Dragonfly Energy Holdings Corp. Common Stock (NV),$1.707,0.027,1.607%,100337999.00,United States,2021,337829,Technology,Electronic Components
DFLIW,Dragonfly Energy Holdings Corp. Warrant,$0.15,-0.01,-6.25%,8817047.00,United States,2021,810,Technology,Electronic Components
DGHI,Digihost Technology Inc. Common Subordinate Voting Shares,$1.00,0.04,4.167%,28600831.00,Canada,,45657,Finance,Finance: Consumer Services
DGICA,Donegal Group Inc. Class A Common Stock,$14.57,0.09,0.622%,482884316.00,United States,,10063,Finance,Property-Casualty Insurers
DGICB,Donegal Group Inc. Class B Common Stock,$13.8002,0.0402,0.292%,457371321.00,United States,1986,1547,Finance,Property-Casualty Insurers
DGII,Digi International Inc. Common Stock,$31.565,0.915,2.985%,1135375310.00,United States,1989,78908,Telecommunications,Computer Communications Equipment
DGLY,Digital Ally Inc. Common Stock,$3.1999,0.0099,0.31%,8962126.00,United States,,4074,Technology,Radio And Television Broadcasting And Communications Equipment
DH,Definitive Healthcare Corp. Class A Common Stock,$8.38,0.07,0.842%,949448436.00,United States,2021,471912,Technology,Computer Software: Prepackaged Software
DHACW,Digital Health Acquisition Corp. Warrant,$0.0225,-0.0017,-7.025%,0.00,United States,2021,38354,Health Care,Medical/Nursing Services
DHC,Diversified Healthcare Trust Common Shares of Beneficial Interest,$2.52,0.19,8.155%,604262643.00,United States,,876171,Real Estate,Real Estate Investment Trusts
DHCA,DHC Acquisition Corp. Class A ordinary share,$10.60,0.001,0.009%,0.00,United States,2021,866,Finance,Blank Checks
DHCAW,DHC Acquisition Corp. Warrant,$0.08,0.00,0.00%,0.00,United States,2021,2000,Finance,Blank Checks
DHCNI,Diversified Healthcare Trust 5.625% Senior Notes due 2042,$14.774,0.024,0.163%,3542609637.00,United States,,31504,Real Estate,Real Estate Investment Trusts
DHCNL,Diversified Healthcare Trust 6.25% Senior Notes Due 2046,$15.77,0.07,0.446%,3781437253.00,United States,,3016,Real Estate,Real Estate Investment Trusts
DHIL,Diamond Hill Investment Group Inc. Class A Common Stock,$165.50,1.67,1.019%,487365890.00,United States,,3768,Finance,Investment Managers
DIBS,1stdibs.com Inc. Common Stock,$4.09,-0.02,-0.487%,158613243.00,United States,2021,62818,Consumer Discretionary,Catalog/Specialty Distribution
DIOD,Diodes Incorporated Common Stock,$78.98,2.05,2.665%,3628245318.00,United States,,80985,Technology,Semiconductors
DISA,Disruptive Acquisition Corporation I Class A Ordinary Shares,$10.45,0.07,0.674%,0.00,United States,2021,3001,Finance,Blank Checks
DISAU,Disruptive Acquisition Corporation I Unit,$10.40,0.04,0.386%,0.00,United States,2021,400,Finance,Blank Checks
DISAW,Disruptive Acquisition Corporation I Warrant,$0.048,-0.0043,-8.222%,0.00,United States,2021,811,Finance,Blank Checks
DISH,DISH Network Corporation Class A Common Stock,$6.765,0.505,8.067%,3611557610.00,United States,1995,6464902,Telecommunications,Cable & Other Pay Television Services
DIST,Distoken Acquisition Corporation Ordinary Shares,$10.47,0.00,0.00%,0.00,China,2023,9,Finance,Blank Checks
DISTR,Distoken Acquisition Corporation Right,$0.19,0.00,0.00%,0.00,China,2023,3,Finance,Blank Checks
DISTW,Distoken Acquisition Corporation Warrant,$0.035,0.01,40.00%,0.00,China,2023,877,Finance,Blank Checks
DJCO,Daily Journal Corp. (S.C.) Common Stock,$292.00,0.99,0.34%,402091592.00,United States,,1092,Consumer Discretionary,Newspapers/Magazines
DKDCA,Data Knights Acquisition Corp. Class A Common Stock,$11.17,0.00,0.00%,84560653.00,United Kingdom,2021,5,Health Care,Biotechnology: Commercial Physical & Biological Resarch
DKDCW,Data Knights Acquisition Corp. Warrant,$0.03,0.0022,7.914%,227110.00,United Kingdom,2021,24355,Health Care,Biotechnology: Commercial Physical & Biological Resarch
DKNG,DraftKings Inc. Class A Common Stock,$31.6225,0.9125,2.971%,27100126367.00,United States,2019,5866697,Consumer Discretionary,Services-Misc. Amusement & Recreation
DLHC,DLH Holdings Corp.,$11.50,0.09,0.789%,159849644.00,United States,,15770,Consumer Discretionary,Professional Services
DLO,DLocal Limited Class A Common Shares,$21.22,-0.30,-1.394%,3439974200.00,Uruguay,2021,1398466,Consumer Discretionary,Business Services
DLPN,Dolphin Entertainment Inc. Common Stock,$1.6939,-0.0061,-0.359%,24054518.00,United States,,12653,Consumer Discretionary,Other Consumer Services
DLTH,Duluth Holdings Inc. Class B Common Stock,$6.04,0.10,1.684%,208841021.00,United States,2015,15160,Consumer Discretionary,Clothing/Shoe/Accessory Stores
DLTR,Dollar Tree Inc. Common Stock,$113.02,0.28,0.248%,24865025792.00,United States,1995,963852,Consumer Discretionary,Department/Specialty Retail Stores
DMAC,DiaMedica Therapeutics Inc. Common Stock,$3.26,0.02,0.617%,123715116.00,United States,2018,24985,Health Care,Pharmaceuticals and Biotechnology
DMAQ,Deep Medicine Acquisition Corp. Class A Common Stock,$11.60,-0.0301,-0.259%,0.00,United States,2021,858,Industrials,Consumer Electronics/Appliances
DMAQR,Deep Medicine Acquisition Corp. Rights,$0.2925,-0.0105,-3.465%,0.00,United States,2021,6253,,
DMK,DMK Pharmaceuticals Corporation Common Stock,$0.70,-0.01,-1.408%,6551393.00,United States,,93722,Health Care,Biotechnology: Pharmaceutical Preparations
DMLP,Dorchester Minerals L.P. Common Units Representing Limited Partnership Interests,$29.19,0.46,1.601%,1130097943.00,United States,,34862,Energy,Oil & Gas Production
DMRC,Digimarc Corporation Common Stock,$33.00,-1.30,-3.79%,671094369.00,United States,,134072,Technology,EDP Services
DMTK,DermTech Inc. Common Stock,$1.95,0.01,0.515%,65674218.00,United States,2017,88846,Health Care,Medical Specialities
DNLI,Denali Therapeutics Inc. Common Stock,$24.235,0.335,1.402%,3330425345.00,United States,2017,387189,Health Care,Biotechnology: Biological Products (No Diagnostic Substances)
DNTH,Dianthus Therapeutics Inc. Common Stock,$12.90,0.39,3.118%,782574591.00,United States,2018,104784,Health Care,Biotechnology: Pharmaceutical Preparations
DNUT,Krispy Kreme Inc. Common Stock,$13.26,0.20,1.531%,2230332000.00,United States,2021,288348,Consumer Staples,Food Chains
DOCU,DocuSign Inc. Common Stock,$44.83,-0.65,-1.429%,9109683781.00,United States,1989,3339964,Technology,Computer Software: Prepackaged Software
DOGZ,Dogness (International) Corporation Class A Common Stock,$0.568,0.048,9.231%,17159280.00,China,2017,14057,Consumer Discretionary,Miscellaneous manufacturing industries
DOMH,Dominari Holdings Inc. Common Stock,$2.56,-0.09,-3.396%,13683999.00,United States,,11776,Health Care,Biotechnology: Pharmaceutical Preparations
DOMO,Domo Inc. Class B Common Stock,$10.12,0.02,0.198%,365158017.00,United States,2018,239990,Technology,Computer Software: Prepackaged Software
DOOO,BRP Inc. (Recreational Products) Common Subordinate Voting Shares,$76.27,1.44,1.924%,5896616062.00,Canada,,34998,Consumer Discretionary,Industrial Specialties
DORM,Dorman Products Inc. Common Stock,$79.07,2.35,3.063%,2489769127.00,United States,,35723,Consumer Discretionary,Auto Parts:O.E.M.
DOX,Amdocs Limited Ordinary Shares,$87.75,0.38,0.435%,10601955000.00,Guernsey,,144829,Technology,EDP Services
DOYU,DouYu International Holdings Limited ADS,$1.00,0.0026,0.261%,319776650.00,China,2019,131488,Technology,Computer Software: Programming Data Processing
DPCS,DP Cap Acquisition Corp I Class A Ordinary Shares,$10.67,0.00,0.00%,0.00,United States,2021,2,Finance,Blank Checks
DPCSW,DP Cap Acquisition Corp I Warrants,$0.0567,0.0023,4.228%,0.00,United States,2021,180,Finance,Blank Checks
DPRO,Draganfly Inc. Common Shares,$0.8524,-0.0021,-0.246%,36942984.00,Canada,,561948,Industrials,Aerospace
DRCT,Direct Digital Holdings Inc. Class A Common Stock,$2.3999,-0.0001,-0.004%,34239172.00,United States,2022,26136,Technology,Computer Software: Programming Data Processing
DRCTW,Direct Digital Holdings Inc. Warrant,$1.1701,0.0001,0.009%,16693718.00,United States,2022,3051,Technology,Computer Software: Programming Data Processing
DRIO,DarioHealth Corp. Common Stock,$3.03,0.12,4.124%,82505518.00,Israel,,91224,Health Care,Medical/Dental Instruments
DRMA,Dermata Therapeutics Inc. Common Stock,$1.091,-0.019,-1.712%,41517550.00,United States,2021,20590,Health Care,Biotechnology: Pharmaceutical Preparations
DRMAW,Dermata Therapeutics Inc. Warrant,$0.0163,0.00,0.00%,620290.00,United States,2021,2500,Health Care,Biotechnology: Pharmaceutical Preparations
DRRX,DURECT Corporation Common Stock,$2.99,0.09,3.103%,82524236.00,United States,2000,177153,Health Care,Biotechnology: Pharmaceutical Preparations
DRS,Leonardo DRS Inc. Common Stock,$16.43,-0.01,-0.061%,4304660000.00,Israel,,448428,Industrials,Military/Government/Technical
DRTS,Alpha Tau Medical Ltd. Ordinary Shares,$3.35,0.05,1.515%,232088000.00,Israel,,9156,Health Care,Medical/Dental Instruments
DRTSW,Alpha Tau Medical Ltd. Warrant,$0.2701,-0.0299,-9.967%,18665261.00,Israel,,200,Health Care,Biotechnology: Pharmaceutical Preparations
DRTT,DIRTT Environmental Solutions Ltd. Common Shares,$0.33,-0.0055,-1.639%,34110933.00,Canada,,85635,,
DRUG,Bright Minds Biosciences Inc. Common Stock,$1.63,0.02,1.242%,6148476.00,Canada,,51600,Health Care,Pharmaceuticals and Biotechnology
DRVN,Driven Brands Holdings Inc. Common Stock,$13.80,0.20,1.471%,2311946872.00,United States,2021,656828,Consumer Discretionary,Automotive Aftermarket
DSGN,Design Therapeutics Inc. Common Stock,$2.68,0.01,0.375%,150044241.00,United States,2021,212058,Health Care,Biotechnology: Pharmaceutical Preparations
DSGR,Distribution Solutions Group Inc. Common Stock,$25.68,0.25,0.983%,1199242390.00,United States,,18253,Industrials,Industrial Machinery/Components
DSGX,Descartes Systems Group Inc. (The) Common Stock,$74.965,0.285,0.382%,6379216317.00,Canada,,94137,,
DSKE,Daseke Inc. Common Stock,$5.44,0.21,4.015%,249440304.00,United States,2015,100090,Consumer Discretionary,Transportation Services
DSP,Viant Technology Inc. Class A Common Stock,$5.82,0.00,0.00%,363312470.00,United States,2021,43600,Technology,EDP Services
DSWL,Deswell Industries Inc. Common Shares,$2.50,0.00,0.00%,39838098.00,Macau,1995,252,Industrials,Plastic Products
DTI,Drilling Tools International Corporation Common Stock,$4.40,-0.05,-1.124%,130981699.00,United States,2021,4727,Industrials,Metal Fabrications
DTIL,Precision BioSciences Inc. Common Stock,$0.4199,-0.0099,-2.303%,48318110.00,United States,2019,495984,Health Care,Biotechnology: Pharmaceutical Preparations
DTOC,Digital Transformation Opportunities Corp. Class A Common Stock,$10.45,-0.22,-2.062%,106428746.00,United States,2021,2354,Health Care,Medical/Nursing Services
DTOCU,Digital Transformation Opportunities Corp. Units,$10.25,0.34,3.431%,104391832.00,United States,2021,720,Health Care,Medical/Nursing Services
DTOCW,Digital Transformation Opportunities Corp. Warrant,$0.29,0.0053,1.862%,2953525.00,United States,2021,104724,Health Care,Medical/Nursing Services
DTSS,Datasea Inc. Common Stock,$0.2963,-0.0038,-1.266%,7585645.00,China,,984572,Technology,Computer Software: Prepackaged Software
DTST,Data Storage Corporation Common Stock,$3.51,0.02,0.573%,23989541.00,United States,,74432,Technology,EDP Services
DTSTW,Data Storage Corporation Warrant,$0.2031,0.00,0.00%,1388113.00,United States,,10,Technology,EDP Services
DUET,DUET Acquisition Corp. Class A Common Stock,$10.70,0.00,0.00%,0.00,Malaysia,2022,100,Finance,Blank Checks
DUETU,DUET Acquisition Corp. Unit,$10.75,0.03,0.28%,0.00,Malaysia,2022,400,Finance,Blank Checks
DUNE,Dune Acquisition Corporation Class A Common Stock,$10.10,0.00,0.00%,55494995.00,United States,2021,143,Finance,Investment Bankers/Brokers/Service
DUNEU,Dune Acquisition Corporation Unit,$10.04,0.00,0.00%,55165322.00,United States,2020,30,Finance,Investment Bankers/Brokers/Service
DUNEW,Dune Acquisition Corporation Warrant,$0.0543,-0.0018,-3.209%,298354.00,United States,2021,600,Finance,Investment Bankers/Brokers/Service
DUO,Fangdd Network Group Ltd. American Depositary Shares,$1.33,-0.11,-7.639%,4920278.00,China,2019,124379,Finance,Real Estate
DUOL,Duolingo Inc. Class A Common Stock,$159.785,-0.855,-0.532%,6637059531.00,United States,2021,156068,Technology,Computer Software: Prepackaged Software
DUOT,Duos Technologies Group Inc. Common Stock,$5.2658,0.2158,4.273%,38127262.00,United States,,13348,Technology,Computer Software: Prepackaged Software
DVAX,Dynavax Technologies Corporation Common Stock,$14.11,0.43,3.143%,1817330707.00,United States,2004,996859,Health Care,Biotechnology: Pharmaceutical Preparations
DWAC,Digital World Acquisition Corp. Class A Common Stock,$16.18,-0.01,-0.062%,602068899.00,United States,2021,140258,Technology,Computer Software: Programming Data Processing
DWACU,Digital World Acquisition Corp. Units,$18.46,0.00,0.00%,686909264.00,United States,2021,106,Technology,Computer Software: Programming Data Processing
DWACW,Digital World Acquisition Corp. Warrants,$5.07,-0.03,-0.588%,188658178.00,United States,2021,9650,Technology,Computer Software: Programming Data Processing
DWSN,Dawson Geophysical Company Common Stock,$2.19,-0.04,-1.794%,54751235.00,United States,,9198,Energy,Oil & Gas Production
DXCM,DexCom Inc. Common Stock,$103.82,-1.40,-1.331%,40268849861.00,United States,2005,2416473,Health Care,Medical/Dental Instruments
DXLG,Destination XL Group Inc. Common Stock,$4.665,0.145,3.208%,281717787.00,United States,,124638,Consumer Discretionary,Clothing/Shoe/Accessory Stores
DXPE,DXP Enterprises Inc. Common Stock,$37.56,0.40,1.076%,628270402.00,United States,,52644,Industrials,Industrial Machinery/Components
DXR,Daxor Corporation Common Stock,$9.5699,0.0199,0.208%,40157042.00,United States,,2352,Health Care,Medical/Dental Instruments
DXYN,Dixie Group Inc. (The) Common Stock,$0.81,0.05,6.579%,12600735.00,United States,,10226,Consumer Discretionary,Home Furnishings
DYAI,Dyadic International Inc. Common Stock,$1.82,0.00,0.00%,52436131.00,United States,,11637,Health Care,Biotechnology: Biological Products (No Diagnostic Substances)
DYN,Dyne Therapeutics Inc. Common Stock,$9.30,0.035,0.378%,567490520.00,United States,2020,937851,Health Care, Medicinal Chemicals and Botanical Products 
DYNT,Dynatronics Corporation Common Stock,$0.759,0.029,3.973%,3070026.00,United States,,1750,Health Care,Medical/Dental Instruments
DZSI,DZS Inc. Common Stock,$2.56,0.14,5.785%,79769032.00,United States,,733795,Utilities,Telecommunications Equipment
EA,Electronic Arts Inc. Common Stock,$123.20,1.52,1.249%,33376316142.00,United States,,1029579,Technology,Computer Software: Prepackaged Software
EACPW,Edify Acquisition Corp. Warrant,$0.0236,0.0036,18.00%,0.00,United States,2021,31800,Finance,Blank Checks
EAR,Eargo Inc. Common Stock,$2.48,-0.07,-2.745%,51458956.00,United States,2020,7260,Health Care,Medical Specialities
EAST,Eastside Distilling Inc. Common Stock,$1.70,0.12,7.595%,1885599.00,United States,,93590,Consumer Staples,Beverages (Production/Distribution)
EBAY,eBay Inc. Common Stock,$44.375,0.665,1.521%,23614484181.00,United States,1998,1980321,Consumer Discretionary,Business Services
EBC,Eastern Bankshares Inc. Common Stock,$13.61,0.31,2.331%,2400486547.00,United States,2020,520143,Finance,Accident &Health Insurance
EBET,EBET INC. Common Stock,$0.0445,0.0008,1.831%,13358154.00,United States,2021,98492995,Consumer Discretionary,Services-Misc. Amusement & Recreation
EBIX,Ebix Inc. Common Stock,$14.3851,0.1951,1.375%,444520305.00,United States,,227171,Technology,EDP Services
EBMT,Eagle Bancorp Montana Inc. Common Stock,$12.20,0.01,0.082%,97455210.00,United States,2010,4181,Finance,Major Banks
EBON,Ebang International Holdings Inc. Class A Ordinary Shares,$7.46,0.18,2.473%,37225400.00,China,2020,2786,Technology,Semiconductors
EBTC,Enterprise Bancorp Inc Common Stock,$29.17,0.55,1.922%,357122972.00,United States,,5235,Finance,Major Banks
ECBK,ECB Bancorp Inc. Common Stock,$11.58,-0.02,-0.172%,106249360.00,United States,2022,3065,Finance,Banks
ECOR,electroCore Inc. Common Stock,$5.6184,0.0184,0.329%,33626366.00,United States,2018,3459,Health Care,Biotechnology: Electromedical & Electrotherapeutic Apparatus
ECPG,Encore Capital Group Inc Common Stock,$47.20,0.66,1.418%,1108496154.00,United States,,45571,Finance,Finance Companies
ECX,ECARX Holdings Inc. Class A Ordinary shares,$3.54,-0.14,-3.804%,1194379716.00,China,,274860,Technology,EDP Services
ECXWW,ECARX Holdings Inc. Warrants,$0.041,0.00,0.00%,0.00,China,,7516,Technology,EDP Services
EDAP,EDAP TMS S.A. American Depositary Shares,$6.51,0.03,0.463%,240290122.00,France,1997,44730,Health Care,Biotechnology: Electromedical & Electrotherapeutic Apparatus
EDBL,Edible Garden AG Incorporated Common Stock,$0.7855,-0.0195,-2.422%,2220673.00,United States,2022,1010081,Consumer Staples,Farming/Seeds/Milling
EDBLW,Edible Garden AG Incorporated Warrant,$0.033,0.002,6.452%,93294.00,United States,2022,11500,Consumer Staples,Farming/Seeds/Milling
EDIT,Editas Medicine Inc. Common Stock,$8.42,-0.05,-0.59%,687346652.00,United States,2016,629240,Health Care,Biotechnology: Biological Products (No Diagnostic Substances)
EDRY,EuroDry Ltd. Common Shares ,$14.10,0.1587,1.138%,40044000.00,Greece,,18183,Consumer Discretionary,Marine Transportation
EDSA,Edesa Biotech Inc. Common Shares,$0.845,0.0049,0.583%,17824138.00,United States,,7735,Health Care,Pharmaceuticals and Biotechnology
EDTK,Skillful Craftsman Education Technology Limited Ordinary Share,$1.03,0.03,3.00%,15912935.00,China,2020,46563,Consumer Discretionary,Educational Services
EDUC,Educational Development Corporation Common Stock,$1.4101,0.0601,4.452%,12091732.00,United States,,3119,Consumer Discretionary,Consumer Specialties
EEFT,Euronet Worldwide Inc. Common Stock,$83.93,1.31,1.586%,4167904881.00,United States,1997,272445,Technology,EDP Services
EEIQ,EpicQuest Education Group International Limited Common Stock,$1.20,-0.0006,-0.05%,13728000.00,United States,2021,7390,Consumer Discretionary,Educational Services
EFHT,EF Hutton Acquisition Corporation I Common Stock,$10.55,0.0127,0.121%,0.00,United States,2022,12300,Consumer Discretionary,Auto Manufacturing
EFHTR,EF Hutton Acquisition Corporation I Rights,$0.20,0.00,0.00%,0.00,United States,2022,600,Finance,Blank Checks
EFOI,Energy Focus Inc. Common Stock,$2.21,-0.04,-1.778%,7724021.00,United States,,3535,Consumer Discretionary,Building Products
EFSC,Enterprise Financial Services Corporation Common Stock,$39.0819,0.7219,1.882%,1461042596.00,United States,,58955,Finance,Major Banks
EFSCP,Enterprise Financial Services Corporation Depositary Shares Each Representing a 1/40th Interest in a Share of 5% Fixed Rate Non-Cumulative Perpetual Preferred Stock Series A,$15.65,0.23,1.492%,585061541.00,United States,,7584,Finance,Major Banks
EFTR,eFFECTOR Therapeutics Inc. Common Stock,$0.6241,-0.0197,-3.06%,38547921.00,United States,2021,455628,Health Care,Biotechnology: Pharmaceutical Preparations
EFTRW,eFFECTOR Therapeutics Inc. Warrant,$0.1102,0.0102,10.20%,6806571.00,United States,2021,20395,Health Care,Biotechnology: Pharmaceutical Preparations
EGAN,eGain Corporation Common Stock,$6.29,0.22,3.624%,200454526.00,United States,1999,64221,Technology,Computer Software: Prepackaged Software
EGBN,Eagle Bancorp Inc. Common Stock,$23.74,0.53,2.283%,709966897.00,United States,,153343,Finance,Major Banks
EGHT,8x8 Inc Common Stock,$2.64,0.05,1.931%,316656682.00,United States,,1679377,Technology,EDP Services
EGIO,Edgio Inc. Common Stock,$0.7555,-0.0745,-8.976%,169954418.00,United States,2007,1662365,Consumer Discretionary,Business Services
EGLX,Enthusiast Gaming Holdings Inc. Common Stock,$0.3895,-0.0079,-1.988%,59113341.00,Canada,,25619,Miscellaneous,Other Pharmaceuticals
EGRX,Eagle Pharmaceuticals Inc. Common Stock,$16.75,-0.29,-1.702%,217531764.00,United States,2014,40926,Health Care,Biotechnology: Pharmaceutical Preparations
EH,EHang Holdings Limited ADS,$16.68,0.50,3.09%,971242606.00,China,2019,298249,Industrials,Military/Government/Technical
EHTH,eHealth Inc. Common Stock,$7.11,0.02,0.282%,199711382.00,United States,2006,73704,Finance,Specialty Insurers
EIGR,Eiger BioPharmaceuticals Inc. Common Stock,$0.4734,0.0634,15.463%,20969924.00,United States,2014,1161887,Health Care,Biotechnology: Biological Products (No Diagnostic Substances)
EJH,E-Home Household Service Holdings Limited Ordinary Shares,$0.107,0.004,3.883%,2579770.00,China,2021,1129041,Consumer Discretionary,Other Consumer Services
EKSO,Ekso Bionics Holdings Inc. Common Stock,$0.79,0.03,3.947%,10907491.00,United States,,8137,Industrials,Industrial Machinery/Components
ELBM,Electra Battery Materials Corporation Common Stock,$0.6812,-0.0088,-1.275%,37588975.00,Canada,,42912,,
ELDN,Eledon Pharmaceuticals Inc. Common Stock,$1.22,-0.01,-0.813%,28725059.00,United States,2014,18275,Health Care,Biotechnology: Pharmaceutical Preparations
ELEV,Elevation Oncology Inc. Common stock,$0.70,-0.0294,-4.031%,29667366.00,United States,2021,136183,Health Care,Biotechnology: Pharmaceutical Preparations
ELOX,Eloxx Pharmaceuticals Inc. Common Stock,$5.8109,1.1709,25.235%,15996094.00,United States,,88753,Health Care,Biotechnology: Biological Products (No Diagnostic Substances)
ELSE,Electro-Sensors Inc. Common Stock,$4.072,0.012,0.296%,13958902.00,United States,,994,Industrials,Industrial Machinery/Components
ELTK,Eltek Ltd. Ordinary Shares,$8.2361,0.1561,1.932%,48181185.00,Israel,1997,7411,Technology,Electrical Products
ELTX,Elicio Therapeutics Inc. Common Stock,$9.25,0.13,1.425%,77593227.00,United States,2021,5249,Health Care,Biotechnology: Pharmaceutical Preparations
ELUT,Elutia Inc. Class A Common Stock,$1.21,0.08,7.08%,19662315.00,United States,2020,22293,Health Care,Medical Specialities
ELVA,Electrovaya Inc. Common Shares,$3.194,-0.036,-1.115%,105314060.00,Canada,,2295,,
ELVN,Enliven Therapeutics Inc. Common Stock,$16.695,0.395,2.423%,778695436.00,United States,2020,36005,Health Care,Biotechnology: Pharmaceutical Preparations
ELWS,Earlyworks Co. Ltd. American Depositary Shares,$1.32,-0.03,-2.222%,19852008.00,Japan,2023,6560,,
ELYM,Eliem Therapeutics Inc Common Stock,$2.69,0.04,1.509%,72870056.00,United States,2021,7828,Health Care,Biotechnology: Pharmaceutical Preparations
ELYS,Elys Game Technology Corp. Common Stock,$0.387,0.017,4.595%,15020570.00,United States,,74036,Technology,Computer Software: Prepackaged Software
EM,Smart Share Global Limited American Depositary Shares,$0.835,-0.0648,-7.202%,216416985.00,China,2021,2892,Consumer Discretionary,Other Consumer Services
EMBC,Embecta Corp. Common Stock,$16.61,0.03,0.181%,951812065.00,United States,,200728,Health Care,Medical/Dental Instruments
EMCG,Embrace Change Acquisition Corp Ordinary Shares,$10.77,0.00,0.00%,0.00,United States,2022,5,Finance,Blank Checks
EMCGR,Embrace Change Acquisition Corp Rights,$0.1564,0.00,0.00%,0.00,United States,2022,43,Finance,Blank Checks
EMCGW,Embrace Change Acquisition Corp Warrants,$0.025,0.001,4.167%,0.00,United States,2022,1006,Finance,Blank Checks
