Symbol,Name,Last Sale,Net Change,% Change,Market Cap,Country,IPO Year,Volume,Sector,Industry
PRTA,Prothena Corporation plc Ordinary Shares,$54.085,0.095,0.176%,2895456701.00,United States,,226682,Health Care,Biotechnology: Pharmaceutical Preparations
PRTC,PureTech Health plc American Depositary Shares,$27.50,0.76,2.842%,766811073.00,United States,,698,Health Care,Biotechnology: Pharmaceutical Preparations
PRTG,Portage Biotech Inc. Common Stock,$2.51,-0.07,-2.713%,42845700.00,Canada,,29811,Energy,Oil & Gas Production
PRTH,Priority Technology Holdings Inc. Common Stock,$3.58,0.02,0.562%,274125641.00,United States,2016,3112,Technology,EDP Services
PRTK,Paratek Pharmaceuticals Inc. Common Stock,$2.20,0.00,0.00%,126109188.00,United States,,195556,Health Care,Biotechnology: Pharmaceutical Preparations
PRTS,CarParts.com Inc. Common Stock,$4.195,-0.035,-0.827%,239185795.00,United States,2007,212789,Consumer Discretionary,Auto & Home Supply Stores
PRVA,Privia Health Group Inc. Common Stock,$23.71,-0.44,-1.822%,2782681662.00,United States,2021,402342,Technology,Retail: Computer Software & Peripheral Equipment
PRZO,ParaZero Technologies Ltd. Ordinary Shares,$1.2042,-0.0158,-1.295%,7288322.00,Israel,2023,61211,,
PSEC,Prospect Capital Corporation Common Stock,$6.13,0.12,1.997%,2498412339.00,United States,2004,941623,Finance,Finance/Investors Services
PSHG,Performance Shipping Inc. Common Shares,$2.04,-0.07,-3.318%,24282956.00,Greece,,297539,Consumer Discretionary,Marine Transportation
PSMT,PriceSmart Inc. Common Stock,$78.22,0.43,0.553%,2428654814.00,United States,,76784,Consumer Discretionary,Department/Specialty Retail Stores
PSNL,Personalis Inc. Common Stock,$1.41,0.02,1.439%,68411650.00,United States,2019,130475,Health Care,Medical Specialities
PSNY,Polestar Automotive Holding UK PLC Class A ADS,$2.75,0.05,1.852%,5802340500.00,Sweden,,2282853,Consumer Discretionary,Auto Manufacturing
PSNYW,Polestar Automotive Holding UK PLC Class C-1 ADS (ADW),$0.5384,0.0084,1.585%,1135992773.00,Sweden,,64596,Consumer Discretionary,Auto Manufacturing
PSTV,PLUS THERAPEUTICS Inc. Common Stock ,$1.3703,-0.0597,-4.175%,3945943.00,United States,,82951,Health Care,Medical/Dental Instruments
PSTX,Poseida Therapeutics Inc. Common Stock,$2.095,0.025,1.208%,182089437.00,United States,2020,144062,Health Care,Biotechnology: Biological Products (No Diagnostic Substances)
PT,Pintec Technology Holdings Limited American Depositary Shares,$1.09,0.03,2.83%,9458977.00,China,2018,52504,Technology,Computer Software: Programming Data Processing
PTC,PTC Inc. Common Stock,$141.02,2.34,1.687%,16757859415.00,United States,,278830,Technology,Computer Software: Prepackaged Software
PTCT,PTC Therapeutics Inc. Common Stock,$37.24,-1.38,-3.573%,2805845975.00,United States,2013,1804490,Health Care,Biotechnology: Pharmaceutical Preparations
PTEN,Patterson-UTI Energy Inc. Common Stock,$15.905,0.175,1.113%,3308138033.00,United States,1993,3207027,Energy,Oil & Gas Production
PTGX,Protagonist Therapeutics Inc. Common Stock,$18.04,-0.40,-2.169%,1037845566.00,United States,2016,344138,Health Care,Biotechnology: Pharmaceutical Preparations
PTHR,Pono Capital Three Inc. Class A Ordinary Shares,$10.56,0.0399,0.379%,0.00,United States,2023,163,Finance,Blank Checks
PTHRU,Pono Capital Three Inc. Unit,$10.61,0.00,0.00%,0.00,United States,2023,1500,Finance,Blank Checks
PTHRW,Pono Capital Three Inc. Warrant,$0.05,0.0049,10.865%,0.00,United States,2023,44317,Finance,Blank Checks
PTIX,Protagenic Therapeutics Inc. Common Stock,$1.8099,-0.02,-1.093%,7838603.00,United States,,13781,Health Care,Biotechnology: Pharmaceutical Preparations
PTIXW,Protagenic Therapeutics Inc. Warrant,$0.035,0.00,0.00%,151584.00,United States,,100,Health Care,Biotechnology: Pharmaceutical Preparations
PTLO,Portillo's Inc. Class A Common Stock,$16.8849,0.0849,0.505%,930382726.00,United States,2021,366821,Consumer Discretionary,Restaurants
PTMN,Portman Ridge Finance Corporation Common Stock,$19.18,0.03,0.157%,182365799.00,United States,2006,14874,Finance,Finance: Consumer Services
PTON,Peloton Interactive Inc. Class A Common Stock,$5.185,0.015,0.29%,1851079817.00,United States,2019,6185711,Consumer Discretionary,Recreational Games/Products/Toys
PTPI,Petros Pharmaceuticals Inc. Common Stock,$1.7701,-0.2099,-10.601%,3741230.00,United States,,10436,Health Care,Biotechnology: Pharmaceutical Preparations
PTRS,Partners Bancorp Common Stock,$7.70,0.02,0.26%,138488943.00,United States,,3748,Finance,Major Banks
PTSI,P.A.M. Transportation Services Inc. Common Stock,$21.87,0.34,1.579%,481891672.00,United States,1986,6346,Industrials,Trucking Freight/Courier Services
PTVE,Pactiv Evergreen Inc. Common stock,$8.18,0.43,5.548%,1459195877.00,United States,2020,67269,Consumer Discretionary,Containers/Packaging
PTWO,Pono Capital Two Inc. Class A Common Stock,$10.56,-0.025,-0.236%,0.00,United States,2022,3947,Finance,Blank Checks
PUBM,PubMatic Inc. Class A Common Stock,$12.85,0.27,2.146%,666503954.00,United States,2020,157084,Technology,Computer Software: Prepackaged Software
PUCK,Goal Acquisitions Corp. Common Stock,$10.53,0.00,0.00%,0.00,United States,2021,10,Finance,Blank Checks
PUCKW,Goal Acquisitions Corp. Warrant,$0.04,0.0219,120.994%,0.00,United States,2021,20966,Finance,Blank Checks
PULM,Pulmatrix Inc. Common Stock,$2.21,-0.03,-1.339%,8071550.00,United States,2014,4729,Health Care,Biotechnology: Pharmaceutical Preparations
PUYI,Puyi Inc. American Depository Shares,$5.23,0.00,0.00%,315445755.00,China,2019,15,Finance,Investment Managers
PVBC,Provident Bancorp Inc. (MD) Common Stock,$9.97,0.01,0.10%,176326628.00,United States,2015,13864,Finance,Banks
PWFL,PowerFleet Inc. Common Stock,$2.17,-0.02,-0.913%,78629976.00,United States,,6214,Telecommunications,Telecommunications Equipment
PWM,Prestige Wealth Inc. Ordinary Shares,$4.91,-0.17,-3.346%,44190000.00,Hong Kong,2023,9964,,
PWOD,Penns Woods Bancorp Inc. Common Stock,$22.745,-0.105,-0.46%,160727224.00,United States,,6117,Finance,Major Banks
PWP,Perella Weinberg Partners Class A Common Stock,$10.67,0.27,2.596%,911340374.00,United States,2020,164480,Finance,Finance: Consumer Services
PWUP,PowerUp Acquisition Corp. Class A Ordinary Shares,$11.00,-0.2422,-2.154%,0.00,United States,2022,242,Finance,Blank Checks
PWUPU,PowerUp Acquisition Corp. Unit,$10.99,-0.11,-0.991%,0.00,United States,2022,450,Finance,Blank Checks
PWUPW,PowerUp Acquisition Corp. Warrant,$0.10,-0.0045,-4.306%,0.00,United States,2022,26430,Finance,Blank Checks
PXDT,Pixie Dust Technologies Inc. American Depositary Shares ,$8.05,0.03,0.374%,0.00,Japan,2023,1894,,
PXLW,Pixelworks Inc.  Common Stock,$1.22,0.01,0.826%,68582158.00,United States,2000,62367,Technology,Semiconductors
PXMD,PaxMedica Inc. Common Stock,$0.2749,0.0009,0.328%,4518396.00,United States,2022,120674,Health Care, Medicinal Chemicals and Botanical Products 
PXS,Pyxis Tankers Inc. Common Stock,$3.45,0.16,4.863%,37087500.00,Greece,,46020,Consumer Discretionary,Marine Transportation
PXSAP,Pyxis Tankers Inc. 7.75% Series A Cumulative Convertible Preferred Shares,$23.20,0.00,0.00%,293580502.00,Greece,,36,Consumer Discretionary,Marine Transportation
PXSAW,Pyxis Tankers Inc. Warrant,$1.00,0.00,0.00%,12654332.00,Greece,,9,Consumer Discretionary,Marine Transportation
PYCR,Paycor HCM Inc. Common Stock,$23.27,0.39,1.705%,4115603639.00,United States,2021,209586,Technology,Computer Software: Prepackaged Software
PYPD,PolyPid Ltd. Ordinary Shares,$0.2641,-0.0109,-3.964%,9643509.00,Israel,2020,63075,Health Care,Medical/Dental Instruments
PYPL,PayPal Holdings Inc. Common Stock,$64.42,1.58,2.514%,70735573882.00,United States,,9397196,Consumer Discretionary,Business Services
PYR,PyroGenesis Canada Inc. Common Shares,$0.5755,0.0055,0.965%,102773017.00,Canada,,14219,,
PYXS,Pyxis Oncology Inc. Common Stock,$2.20,-0.04,-1.786%,86959052.00,United States,2021,93436,Health Care,Biotechnology: Pharmaceutical Preparations
PZZA,Papa John's International Inc. Common Stock,$78.38,0.89,1.149%,2565915244.00,United States,1993,873494,Consumer Discretionary,Restaurants
QCOM,QUALCOMM Incorporated Common Stock,$114.50,1.86,1.651%,127782000000.00,United States,1991,3987734,Technology,Radio And Television Broadcasting And Communications Equipment
QCRH,QCR Holdings Inc. Common Stock,$50.24,0.92,1.865%,839787474.00,United States,,18311,Finance,Major Banks
QDEL,QuidelOrtho Corporation Common Stock,$76.45,0.08,0.105%,5106142823.00,United States,,219138,Health Care,Medical Specialities
QDRO,Quadro Acquisition One Corp. Class A Ordinary Shares,$10.70,0.00,0.00%,0.00,United States,2021,37,Finance,Blank Checks
QDROW,Quadro Acquisition One Corp.  Warrant,$0.1082,0.014,14.862%,0.00,United States,2021,2700,Finance,Blank Checks
QFIN,Qifu Technology Inc. American Depositary Shares,$15.94,0.25,1.593%,2572652750.00,China,2018,201807,Finance,Finance: Consumer Services
QH,Quhuo Limited American Depository Shares,$1.62,0.06,3.846%,9991546.00,China,2020,54853,Consumer Discretionary,Business Services
QIPT,Quipt Home Medical Corp. Common Shares,$5.77,0.14,2.487%,241142552.00,United States,,64342,Health Care,Misc Health and Biotechnology Services
QLGN,Qualigen Therapeutics Inc. Common Stock,$1.0199,0.0428,4.38%,5153007.00,United States,2015,7704,Health Care,Biotechnology: Pharmaceutical Preparations
QLI,Qilian International Holding Group Ltd. Ordinary Shares,$0.785,0.0147,1.908%,28063750.00,China,2021,486,Health Care,Biotechnology: Pharmaceutical Preparations
QLYS,Qualys Inc. Common Stock,$153.00,0.18,0.118%,5616947475.00,United States,2012,162241,Technology,EDP Services
QMCO,Quantum Corporation Common Stock,$0.7593,0.0853,12.656%,72164334.00,United States,,560360,Technology,Electronic Components
QNCX,Quince Therapeutics Inc. Common Stock,$1.26,-0.02,-1.563%,45842566.00,United States,2019,57003,Health Care,Biotechnology: Biological Products (No Diagnostic Substances)
QNRX,Quoin Pharmaceuticals Ltd. American Depositary Shares,$5.62,0.16,2.93%,5548160.00,Israel,2016,2979,Health Care,Medical/Dental Instruments
QNST,QuinStreet Inc. Common Stock,$9.28,0.13,1.421%,506563147.00,United States,2010,78604,Consumer Discretionary,Business Services
QOMO,Qomolangma Acquisition Corp. Common Stock,$10.69,0.00,0.00%,0.00,United States,2022,523,Finance,Blank Checks
QOMOW,Qomolangma Acquisition Corp. Warrant,$0.0265,-0.001,-3.636%,0.00,United States,2022,300,Finance,Blank Checks
QQQX,Nuveen NASDAQ 100 Dynamic Overwrite Fund Shares of Beneficial Interest,$22.59,0.07,0.311%,0.00,United States,,106698,Finance,Finance Companies
QRHC,Quest Resource Holding Corporation Common Stock,$7.85,0.22,2.883%,154834750.00,United States,,8825,Utilities,Environmental Services
QRTEA,Qurate Retail Inc. Series A Common Stock ,$0.6374,0.032,5.286%,247813720.00,United States,,7294358,Consumer Discretionary,Catalog/Specialty Distribution
QRTEB,Qurate Retail Inc. Series B Common Stock ,$5.25,-0.15,-2.778%,2041139053.00,United States,,914,Consumer Discretionary,Catalog/Specialty Distribution
QRTEP,Qurate Retail Inc. 8.0% Fixed Rate Cumulative Redeemable Preferred Stock,$32.89,0.125,0.382%,12787250180.00,United States,,20234,Consumer Discretionary,Catalog/Specialty Distribution
QRVO,Qorvo Inc. Common Stock,$95.99,1.65,1.749%,9398423616.00,United States,,884808,Technology,Semiconductors
QSG,QuantaSing Group Limited American Depositary Shares,$6.42,-0.03,-0.465%,350805736.00,China,2023,18215,Consumer Discretionary,Educational Services
QSI,Quantum-Si Incorporated Class A Common Stock,$2.352,0.032,1.379%,46893000.00,United States,2020,400638,Health Care,Biotechnology: Pharmaceutical Preparations
QSIAW,Quantum-Si Incorporated Warrant,$0.49,0.0475,10.734%,9769375.00,United States,2020,21863,Health Care,Biotechnology: Pharmaceutical Preparations
QTRX,Quanterix Corporation Common Stock,$26.905,1.225,4.77%,1010352326.00,United States,2017,157820,Industrials,Biotechnology: Laboratory Analytical Instruments
QUBT,Quantum Computing Inc. Common Stock,$1.30,0.02,1.563%,96585281.00,United States,,565727,Technology,Computer Manufacturing
QUIK,QuickLogic Corporation Common Stock,$8.6353,0.1753,2.072%,119673618.00,United States,1999,22941,Technology,Semiconductors
QURE,uniQure N.V. Ordinary Shares,$7.77,0.08,1.04%,370659940.00,Netherlands,2014,686925,Health Care,Biotechnology: Pharmaceutical Preparations
RADI,Radius Global Infrastructure Inc. Class A Common Stock,$14.805,0.085,0.577%,1476310777.00,United States,,4423546,Consumer Discretionary,Telecommunications Equipment
RAIL,FreightCar America Inc. Common Stock,$2.765,0.025,0.912%,49500855.00,United States,2005,3464,Industrials,Railroads
RAIN,Rain Oncology Inc. Common Stock,$0.8963,0.0263,3.023%,32603514.00,United States,2021,55782,Health Care,Biotechnology: Pharmaceutical Preparations
RAND,Rand Capital Corporation Common Stock,$13.78,0.03,0.218%,35566469.00,United States,,815,Finance,Finance/Investors Services
RANI,Rani Therapeutics Holdings Inc. Class A Common Stock,$2.9167,-0.1333,-4.37%,144808952.00,United States,2021,48148,Health Care, Medicinal Chemicals and Botanical Products 
RAPT,RAPT Therapeutics Inc. Common Stock,$19.32,0.18,0.94%,663799497.00,United States,2019,119839,Health Care,Biotechnology: Pharmaceutical Preparations
RARE,Ultragenyx Pharmaceutical Inc. Common Stock,$39.51,-1.445,-3.528%,2824514507.00,United States,2014,283271,Health Care,Biotechnology: Pharmaceutical Preparations
RAVE,Rave Restaurant Group Inc. Common Stock,$1.80,-0.01,-0.552%,29520970.00,United States,,34531,Consumer Discretionary,Restaurants
RAYA,Erayak Power Solution Group Inc. Class A Ordinary Shares,$1.06,-0.11,-9.402%,13197000.00,China,2022,19226,Consumer Discretionary,Metal Fabrications
RBB,RBB Bancorp Common Stock,$13.53,0.12,0.895%,257006450.00,United States,2017,3120,Finance,Major Banks
RBBN,Ribbon Communications Inc. Common Stock,$2.825,0.115,4.244%,483490894.00,United States,,226378,Technology,EDP Services
RBCAA,Republic Bancorp Inc. Class A Common Stock,$43.709,0.433,1.001%,854201447.00,United States,1998,3965,Finance,Major Banks
RBKB,Rhinebeck Bancorp Inc. Common Stock,$6.71,-0.05,-0.74%,74372949.00,United States,2019,1522,Finance,Major Banks
RCAC,Revelstone Capital Acquisition Corp. Class A Common Stock,$10.62,0.03,0.283%,0.00,United States,2022,23414,Finance,Blank Checks
RCACW,Revelstone Capital Acquisition Corp. Warrant,$0.0996,0.0025,2.575%,0.00,United States,2022,500,Finance,Blank Checks
RCAT,Red Cat Holdings Inc. Common Stock,$0.97,0.0042,0.435%,53874938.00,United States,,26958,Industrials,Wholesale Distributors
RCEL,Avita Medical Inc. Common Stock,$15.86,0.15,0.955%,404085854.00,United States,,49441,Health Care,Medical/Dental Instruments
RCKT,Rocket Pharmaceuticals Inc. Common Stock,$23.90,2.67,12.577%,1924560191.00,United States,2015,4819781,Health Care,Biotechnology: Pharmaceutical Preparations
RCKTW,Rocket Pharmaceuticals Inc. Warrant,$0.15,-0.0099,-6.191%,,United States,,59103,Health Care,Biotechnology: Pharmaceutical Preparations
RCKY,Rocky Brands Inc. Common Stock,$17.18,1.88,12.288%,126551333.00,United States,1993,63901,Consumer Discretionary,Shoe Manufacturing
RCM,R1 RCM Inc. Common Stock,$16.165,-0.195,-1.192%,6772464395.00,United States,,1259094,Consumer Discretionary,Other Consumer Services
RCMT,RCM Technologies Inc. Common Stock,$19.74,0.41,2.121%,157440298.00,United States,,23586,Consumer Discretionary,Professional Services
RCON,Recon Technology Ltd. Class A Ordinary Shares,$0.3611,0.0011,0.306%,14634740.00,China,2009,60222,Energy,Oilfield Services/Equipment
RCRT,Recruiter.com Group Inc. Common Stock,$1.56,-0.03,-1.887%,1850383.00,United States,,23293,Technology,EDP Services
RDCM,Radcom Ltd. Ordinary Shares,$8.75,0.05,0.575%,131162500.00,Israel,1997,2338,Technology,Computer peripheral equipment
RDFN,Redfin Corporation Common Stock,$8.835,-0.085,-0.953%,1006970812.00,United States,2017,1747435,Finance,Real Estate
RDHL,Redhill Biopharma Ltd. American Depositary Shares,$0.8091,-0.0007,-0.086%,4736899.00,Israel,,10404,Health Care,Biotechnology: Pharmaceutical Preparations
RDI,Reading International Inc Class A Common Stock,$2.23,0.06,2.765%,49669736.00,United States,,39204,Consumer Discretionary,Movies/Entertainment
RDIB,Reading International Inc Class B Common Stock,$19.81,-0.19,-0.95%,441236529.00,United States,,18910,Consumer Discretionary,Movies/Entertainment
RDNT,RadNet Inc. Common Stock,$28.73,1.20,4.359%,1947107574.00,United States,,267311,Health Care,Medical Specialities
RDUS,Schnitzer Steel Industries Inc. Class A Common Stock,$29.36,1.42,5.082%,806077567.00,United States,,159557,Consumer Discretionary,Industrial Specialties
RDVT,Red Violet Inc. Common Stock ,$20.50,0.32,1.586%,285226566.00,United States,,14209,Technology,Computer Software: Prepackaged Software
RDWR,Radware Ltd. Ordinary Shares,$16.85,0.05,0.298%,738365315.00,Israel,1999,52368,Consumer Discretionary,Business Services
REAL,The RealReal Inc. Common Stock,$2.4689,0.0889,3.735%,252178285.00,United States,2019,1759565,Consumer Discretionary,Consumer Specialties
REAX,The Real Brokerage Inc. Common Shares,$1.73,0.03,1.765%,311400000.00,Canada,,85530,Finance,Real Estate
REBN,Reborn Coffee Inc. Common Stock,$0.588,0.017,2.977%,7769081.00,United States,2022,9271,Consumer Discretionary,Restaurants
REE,REE Automotive Ltd. Class A Ordinary Shares,$0.1552,-0.0049,-3.061%,37878112.00,Israel,,587226,Consumer Discretionary,Auto Manufacturing
REFI,Chicago Atlantic Real Estate Finance Inc. Common Stock,$14.9847,0.2947,2.006%,272352811.00,United States,2021,73779,Real Estate,Real Estate Investment Trusts
REFR,Research Frontiers Incorporated Common Stock,$1.38,-0.03,-2.128%,46242816.00,United States,,10104,Miscellaneous,Multi-Sector Companies
REG,Regency Centers Corporation Common Stock,$64.265,1.245,1.976%,10989521741.00,United States,1993,337403,Real Estate,Real Estate Investment Trusts
REGCO,Regency Centers Corporation 5.875% Series B Cumulative Redeemable Preferred Stock,$21.7206,0.2706,1.262%,0.00,United States,,29658,,
REGCP,Regency Centers Corporation 6.25% Series A Cumulative Redeemable Preferred Stock,$23.44,0.0064,0.027%,0.00,United States,,1033,,
REGN,Regeneron Pharmaceuticals Inc. Common Stock,$832.26,6.01,0.727%,90349078643.00,United States,1991,181225,Health Care,Biotechnology: Pharmaceutical Preparations
REKR,Rekor Systems Inc. Common Stock,$3.43,-0.26,-7.046%,236502462.00,United States,,921519,Telecommunications,Telecommunications Equipment
RELI,Reliance Global Group Inc. Common Stock,$2.60,0.02,0.775%,5528505.00,United States,,177379,Finance,Specialty Insurers
RELIW,Reliance Global Group Inc. Series A Warrants,$0.0818,0.00,0.00%,173935.00,United States,,1,Finance,Specialty Insurers
RELL,Richardson Electronics Ltd. Common Stock,$11.825,0.185,1.589%,168342616.00,United States,1983,26325,Technology,Electronic Components
RELY,Remitly Global Inc. Common Stock,$25.53,0.52,2.079%,4626001432.00,United States,2021,546793,Technology,Computer Software: Prepackaged Software
RENB,Renovaro Biosciences Inc. Common Stock,$3.17,-0.14,-4.23%,184758983.00,United States,,63230,Health Care,Biotechnology: Pharmaceutical Preparations
RENE,Cartesian Growth Corporation II Class A Ordinary Shares,$10.77,0.00,0.00%,0.00,United States,2022,16,Finance,Blank Checks
RENEU,Cartesian Growth Corporation II Unit,$10.87,0.07,0.648%,0.00,United States,2022,453,Finance,Blank Checks
RENT,Rent the Runway Inc. Class A Common Stock,$0.8991,0.0091,1.022%,61993426.00,United States,2021,750244,Consumer Discretionary,Other Specialty Stores
REPL,Replimune Group Inc. Common Stock,$18.55,-0.16,-0.855%,1094381847.00,United States,2018,296237,Health Care,Biotechnology: Biological Products (No Diagnostic Substances)
RETA,Reata Pharmaceuticals Inc. Class A Common Stock,$172.03,0.03,0.017%,6562950349.00,United States,2016,188065,Health Care,Biotechnology: Pharmaceutical Preparations
RETO,ReTo Eco-Solutions Inc. Common Shares,$0.58,0.0139,2.455%,3120400.00,China,2017,128726,Industrials,Industrial Machinery/Components
REVB,Revelation Biosciences Inc. Common Stock,$0.745,-0.005,-0.667%,4691491.00,United States,2020,21244,Health Care,Biotechnology: Pharmaceutical Preparations
REVBW,Revelation Biosciences Inc. Warrant,$0.0148,-0.0019,-11.377%,93200.00,United States,2020,10590,Health Care,Biotechnology: Pharmaceutical Preparations
REYN,Reynolds Consumer Products Inc. Common Stock,$25.70,0.11,0.43%,5397237237.00,United States,2020,93623,Consumer Discretionary,Containers/Packaging
RFAC,RF Acquisition Corp. Class A Common Stock,$10.6301,-0.0901,-0.84%,0.00,Singapore,2022,300,Finance,Blank Checks
RFIL,RF Industries Ltd. Common Stock,$3.65,0.00,0.00%,37562395.00,United States,,2819,Technology,Electrical Products
RGC,Regencell Bioscience Holdings Limited Ordinary Shares,$13.00,-1.89,-12.693%,169130000.00,Hong Kong,2021,5113,Health Care, Medicinal Chemicals and Botanical Products 
RGCO,RGC Resources Inc. Common Stock,$18.08,0.14,0.78%,180821642.00,United States,,9545,Utilities,Oil & Gas Production
RGEN,Repligen Corporation Common Stock,$164.76,5.79,3.642%,9186411613.00,United States,1986,214288,Health Care,Biotechnology: Biological Products (No Diagnostic Substances)
RGF,The Real Good Food Company Inc. Class A Common Stock,$4.00,0.09,2.302%,103522528.00,United States,2021,29172,Consumer Staples,Packaged Foods
RGLD,Royal Gold Inc. Common Stock,$111.21,1.42,1.293%,7305244108.00,United States,,233449,Industrials,Precious Metals
RGLS,Regulus Therapeutics Inc. Common Stock,$1.70,0.04,2.41%,33123584.00,United States,2012,21446,Health Care,Biotechnology: Pharmaceutical Preparations
RGNX,REGENXBIO Inc. Common Stock,$18.10,0.08,0.444%,795677955.00,United States,2015,147118,Health Care,Biotechnology: Biological Products (No Diagnostic Substances)
RGP,Resources Connection Inc. Common Stock,$15.14,0.43,2.923%,509808175.00,United States,,44478,Consumer Discretionary,Business Services
RGTI,Rigetti Computing Inc. Common Stock,$1.98,-0.02,-1.00%,0.00,United States,,3442270,Technology,Retail: Computer Software & Peripheral Equipment
RGTIW,Rigetti Computing Inc. Warrants,$0.3143,-0.0646,-17.049%,0.00,United States,,25364,Technology,Retail: Computer Software & Peripheral Equipment
RIBT,RiceBran Technologies Common Stock,$0.49,-0.0379,-7.179%,3237810.00,United States,,40990,Consumer Staples,Packaged Foods
RICK,RCI Hospitality Holdings Inc. Common Stock,$64.32,1.12,1.772%,605880571.00,United States,1995,22831,Consumer Discretionary,Restaurants
RIGL,Rigel Pharmaceuticals Inc. Common Stock,$1.09,0.00,0.00%,190057072.00,United States,2000,2144737,Health Care,Biotechnology: Pharmaceutical Preparations
RILY,B. Riley Financial Inc. Common Stock,$45.98,1.40,3.14%,1405690398.00,United States,,138691,Finance,Investment Managers
RILYG,B. Riley Financial Inc. 5.00% Senior Notes due 2026,$20.533,0.058,0.283%,627730338.00,United States,,14647,Finance,Investment Managers
RILYK,B. Riley Financial Inc. 5.50% Senior Notes Due 2026,$22.49,-0.05,-0.222%,687559310.00,United States,,1951,Finance,Investment Managers
RILYL,B. Riley Financial Inc. Depositary Shares each representing 1/1000th in a share of 7.375% Series B Cumulative Perpetual Preferred Stock par value $0.0001,$23.98,0.04,0.167%,733111260.00,United States,,492,Finance,Investment Managers
RILYM,B. Riley Financial Inc. 6.375% Senior Notes due 2025,$23.8499,-0.0001,0.00%,729133872.00,United States,,2373,Finance,Investment Managers
RILYN,B. Riley Financial Inc. 6.50% Senior Notes Due 2026,$22.00,-0.11,-0.498%,672579138.00,United States,,4989,Finance,Investment Managers
RILYO,B. Riley Financial Inc. 6.75% Senior Notes due 2024,$24.735,0.075,0.304%,756192954.00,United States,,4342,Finance,Investment Managers
RILYP,B. Riley Financial Inc. Depositary Shares each representing a 1/1000th fractional interest in a share of Series A Cumulative Perpetual Preferred Stock,$21.40,0.10,0.469%,654236071.00,United States,,2539,Finance,Investment Managers
RILYT,B. Riley Financial Inc. 6.00% Senior Notes Due 2028,$20.52,0.31,1.534%,627332905.00,United States,,637,Finance,Investment Managers
RILYZ,B. Riley Financial Inc. 5.25% Senior Notes due 2028,$18.29,-0.08,-0.435%,559157838.00,United States,,16396,Finance,Investment Managers
RIOT,Riot Platforms Inc. Common Stock ,$11.03,0.75,7.296%,2043923316.00,United States,,17917837,Finance,Finance: Consumer Services
RIVN,Rivian Automotive Inc. Class A Common Stock,$24.055,0.805,3.462%,22807420886.00,United States,2021,16414594,Consumer Discretionary,Auto Manufacturing
RKDA,Arcadia Biosciences Inc. Common Stock,$3.815,-0.036,-0.935%,54974696.00,United States,2015,3688,Industrials,Agricultural Chemicals
RKLB,Rocket Lab USA Inc. Common Stock,$5.282,-0.083,-1.547%,2552931175.00,United States,2020,3447121,Industrials,Aerospace
RLAY,Relay Therapeutics Inc. Common Stock,$9.658,0.168,1.77%,1179567429.00,United States,2020,407706,Health Care,Biotechnology: Biological Products (No Diagnostic Substances)
RLMD,Relmada Therapeutics Inc. Common Stock,$3.32,-0.01,-0.30%,99929354.00,United States,,38657,Health Care,Biotechnology: Pharmaceutical Preparations
RLYB,Rallybio Corporation Common Stock,$5.07,-0.49,-8.813%,191650340.00,United States,2021,35521,Health Care,Biotechnology: Pharmaceutical Preparations
RMBI,Richmond Mutual Bancorporation Inc. Common Stock,$11.36,0.12,1.068%,129766132.00,United States,2019,9801,,
RMBL,RumbleOn Inc. Class B Common Stock,$5.9703,-0.3197,-5.083%,99835321.00,United States,,95554,Technology,EDP Services
RMBS,Rambus Inc. Common Stock,$59.59,0.90,1.533%,6503144655.00,United States,1997,974890,Technology,Semiconductors
RMCF,Rocky Mountain Chocolate Factory Inc. Common Stock,$4.99,-0.02,-0.399%,31402619.00,United States,,915,Consumer Staples,Specialty Foods
RMGC,RMG Acquisition Corp. III Class A Ordinary Shares,$10.55,-0.05,-0.472%,0.00,United States,2021,113,Finance,Blank Checks
